date,data,url,
2015-03-16,"Expect our loan book size to be around Rs 11,000 cr by next year: C Ilango, CanFin Homes",https://economictimes.indiatimes.com/opinion/interviews/expect-our-loan-book-size-to-be-around-rs-11000-cr-by-next-year-c-ilango-canfin-homes/articleshow/46582640.cms,
2017-07-08,How SMEs can find balance between challenges and benefits through BI implementation,https://economictimes.indiatimes.com/small-biz/sme-sector/how-smes-can-find-balance-between-challenges-and-benefits-through-bi-implementation/articleshow/59501844.cms,
2017-04-26,"We will achieve our target of Rs 35K crore loan book by 2022: Sarada Kumar Hota, Can Fin Homes",https://economictimes.indiatimes.com/markets/expert-view/we-will-achieve-our-target-of-rs-35k-crore-loan-book-by-2022-sarada-kumar-hota-md-ceo-can-fin-homes/articleshow/58375221.cms,
2016-11-12,Is your child allergic to peanuts? Here's how you can find out,https://economictimes.indiatimes.com/magazines/panache/worried-about-your-child-being-allergic-to-peanuts-heres-how-you-can-find-out/articleshow/55386788.cms,
2017-08-28,"Buy  Can Fin Homes target Rs  3,330:   Reliance Securities",https://economictimes.indiatimes.com/markets/stocks/recos/buy-can-fin-homes-target-rs-3330-reliance-securities/articleshow/60252727.cms,
2014-11-05,Here's how you can find a few good men and women in media agencies,https://economictimes.indiatimes.com/magazines/brand-equity/heres-how-you-can-find-a-few-good-men-and-women-in-media-agencies/articleshow/45036911.cms,
2017-03-11,Canara Bank sells 13.45% in Can Fin Homes to GIC,https://economictimes.indiatimes.com/markets/stocks/news/canara-bank-sells-1345-in-can-fin-homes-to-gic/articleshow/57588785.cms,
2016-11-23,Canara Bank to dilute stake in Can Fin Homes,https://economictimes.indiatimes.com/markets/stocks/news/canara-bank-to-dilute-stake-in-can-fin-homes/articleshow/55578131.cms,
2016-12-06,"Can Fin Homes, Canara Bank jump up to 5% on stake dilution plan",https://economictimes.indiatimes.com/markets/stocks/news/can-fin-homes-canara-bank-jump-up-to-5-on-stake-dilution-plan/articleshow/55828814.cms,
2017-09-25,"Sell  Can Fin Homes, target Rs  2,625:   Dr CK Narayan",https://economictimes.indiatimes.com/markets/stocks/recos/sell-can-fin-homes-target-rs-2625-dr-ck-narayan/articleshow/60821755.cms,
2016-11-18,Here's how you can find out whether you are a true friend or not,https://economictimes.indiatimes.com/magazines/panache/heres-how-you-can-find-out-whether-you-are-a-true-friend-or-not/articleshow/55488293.cms,
2017-08-14,Sebi questions CRISIL investment in CARE Ratings,https://economictimes.indiatimes.com/markets/stocks/policy/sebi-takes-care-ratings-to-question-crisil-deal/articleshow/60050138.cms,
2017-02-16,Bad Bank will be far more useful than the Asset Reconstruction Companies: CARE Ratings,https://economictimes.indiatimes.com/industry/banking/finance/bad-bank-will-be-far-more-useful-than-the-asset-reconstruction-companies-care-ratings/articleshow/57187254.cms,
2016-08-22,Rajesh Mokashi takes charge as MD & CEO of Care Ratings,https://economictimes.indiatimes.com/news/company/corporate-trends/rajesh-mokashi-takes-charge-as-md-ceo-of-care-ratings/articleshow/53811674.cms,
2016-11-02,"Disappointed with the international ratings given to India: Rajesh Mokashi, CARE Ratings",https://economictimes.indiatimes.com/markets/expert-view/disappointed-with-the-international-ratings-given-to-india-rajesh-mokashi-care-ratings/articleshow/55203380.cms,
2016-11-18,Demonetisation to lower GDP growth by 0.3-0.5%: CARE Ratings,https://economictimes.indiatimes.com/news/economy/indicators/demonetisation-to-lower-gdp-growth-by-03-05-care-ratings/articleshow/55498209.cms,
2017-02-06,"Higher other income led to sharp rise in PAT: Rajesh Mokashi, CARE Ratings",https://economictimes.indiatimes.com/opinion/interviews/higher-other-income-led-to-sharp-rise-in-pat-rajesh-mokashi-care-ratings/articleshow/56995890.cms,
2014-11-03,"Growth recovery is going to be slow and gradual: Madan Sabnavis, CARE Ratings",https://economictimes.indiatimes.com/opinion/interviews/growth-recovery-is-going-to-be-slow-and-gradual-madan-sabnavis-care-ratings/articleshow/45022039.cms,
2016-05-17,Securitisation market volume rises in FY 2016: Care Ratings,https://economictimes.indiatimes.com/industry/banking/finance/banking/securitisation-market-volume-rises-in-fy-2016-care-ratings/articleshow/52311104.cms,
2015-09-13,Battery-free 'smart' cameras can find their own position,https://economictimes.indiatimes.com/magazines/panache/battery-free-smart-cameras-can-find-their-own-position/articleshow/48944337.cms,
2016-10-19,The government is pushing hard for housing for all: Sarada Kumar Hota of Canfin Homes,https://economictimes.indiatimes.com/opinion/interviews/the-government-is-pushing-hard-for-housing-for-all-sarada-kumar-hota-of-canfin-homes/articleshow/54933442.cms,
2016-03-04,"Betting on Can Fin Homes and HPCL: Rahul Shah, MOFSL",https://economictimes.indiatimes.com/markets/expert-view/betting-on-can-fin-homes-and-hpcl-rahul-shah-mofsl/articleshow/51255702.cms,
2016-07-04,Laptop hacked? You can find your data here,https://economictimes.indiatimes.com/industry/telecom/laptop-hacked-you-can-find-your-data-here/articleshow/53045859.cms,
2012-04-17,I would look for a target of 138 in Can Fin Homes: Mitesh Thacker,https://economictimes.indiatimes.com/markets/stocks/views/recommendations/i-would-look-for-a-target-of-138-in-can-fin-homes-mitesh-thacker/articleshow/12703482.cms,
2012-04-03,Ashok Leyland can find support around 27-27.50: Ashwani Gujral,https://economictimes.indiatimes.com/markets/stocks/views/recommendations/ashok-leyland-can-find-support-around-27-2750-ashwani-gujral/articleshow/12518349.cms,
2013-11-22,"Businesses are not adapting to climate change: Pascal Canfin, French Minister for development",https://economictimes.indiatimes.com/opinion/interviews/businesses-are-not-adapting-to-climate-change-pascal-canfin-french-minister-for-development/articleshow/26169284.cms,
2016-04-29,Can Fin Homes surges as net profit more than doubles,https://economictimes.indiatimes.com/markets/stocks/news/can-fin-homes-surges-as-net-profit-more-than-doubles/articleshow/52036154.cms,
2017-01-17,CanFin Homes Q3 net profit jumps 41% to Rs 60 crore,https://economictimes.indiatimes.com/markets/stocks/earnings/canfin-homes-q3-net-profit-jumps-41-to-rs-60-crore/articleshow/56624017.cms,
2014-12-15,Recommend to buy Can Fin Homes Ltd: Neeraj Deewan,https://economictimes.indiatimes.com/markets/stocks/recos/recommend-to-buy-can-fin-homes-ltd-neeraj-deewan/articleshow/45522095.cms,
2016-03-31,Can Fin Homes is cheaper compared to other housing fin cos: Rahul Shah,https://economictimes.indiatimes.com/markets/stocks/recos/can-fin-homes-is-cheaper-compared-to-other-housing-fin-cos-rahul-shah/articleshow/51630335.cms,
2016-12-30,Buy  Can Fin Homes with a target of Rs  2260:  Motilal Oswal Securities,https://economictimes.indiatimes.com/markets/stocks/recos/buy-can-fin-homes-with-a-target-of-rs-2260-motilal-oswal-securities/articleshow/56252785.cms,
2017-05-15,"Can Fin Homes mulls raising Rs 6,000 crore",https://economictimes.indiatimes.com/markets/stocks/news/can-fin-homes-mulls-raising-rs-6000-crore/articleshow/58685948.cms,
2017-06-20,"Can Fin, SpiceJet have more steam left: Deepak Shenoy",https://economictimes.indiatimes.com/markets/expert-view/can-fin-spicejet-have-more-steam-left-deepak-shenoy/articleshow/59238354.cms,
2017-03-15,"There is room this year for a rate cut: Madan Sabnavis, Chief Economist, CARE Ratings",https://economictimes.indiatimes.com/opinion/interviews/there-is-room-this-year-for-a-rate-cut-madan-sabnavis-chief-economist-care-ratings/articleshow/57650481.cms,
2017-05-12,"Even 2011-12 as base year is fairly outdated as we are in 2017-18: Madan Sabnavis, CARE Ratings",https://economictimes.indiatimes.com/markets/expert-view/even-2011-12-as-base-year-is-fairly-outdated-as-we-are-in-2017-18-madan-sabnavis-care-ratings/articleshow/58643542.cms,
2015-02-23,Can Fin Homes to outperform from a long-term perspective, buy with a target of Rs 920: Devang Mehta,https://economictimes.indiatimes.com/markets/stocks/recos/can-fin-homes-to-outperform-from-a-long-term-perspective-buy-with-a-target-of-rs-920-devang-mehta/articleshow/46342480.cms
2016-07-15,"Our loan book has grown by 28.4%: Sarada Kumar Hota, MD, Can Fin Homes",https://economictimes.indiatimes.com/markets/expert-view/our-loan-book-has-grown-by-284-sarada-kumar-hota-md-can-fin-homes/articleshow/53222117.cms,
2012-12-26,"EBITDA margin to remain stable at around 75%: Rajesh Mokashi, CARE Ratings",https://economictimes.indiatimes.com/opinion/interviews/ebitda-margin-to-remain-stable-at-around-75-rajesh-mokashi-care-ratings/articleshow/17767776.cms,
2015-02-12,Can Fin Homes' Rs 276 crore rights issue to open today,https://economictimes.indiatimes.com/markets/ipos/fpos/can-fin-homes-rs-276-crore-rights-issue-to-open-today/articleshow/46212371.cms,
2015-05-05,Prefer stocks of HFCs to real estate scrips, Can Fin Homes at Rs 620-650 could be a good buy: Mehraboon Irani,https://economictimes.indiatimes.com/markets/stocks/recos/prefer-stocks-of-hfcs-to-real-estate-scrips-can-fin-homes-at-rs-620-650-could-be-a-good-buy-mehraboon-irani/articleshow/47147784.cms
2016-08-11,India Inc sees recovery in earnings in Q1 FY’17: Care Ratings,https://economictimes.indiatimes.com/markets/stocks/earnings/india-inc-sees-recovery-in-earnings-in-q1-fy17-care-ratings/articleshow/53654323.cms,
2016-02-01,"Investment cycle unlikely to start in Q4: DR Dogra, Care Ratings",https://economictimes.indiatimes.com/opinion/interviews/investment-cycle-unlikely-to-start-in-q4-dr-dogra-care-ratings/articleshow/50805423.cms,
2014-03-05,Buy Can Fin Homes with target price of Rs 210: Sandeep Wagle,https://economictimes.indiatimes.com/markets/stocks/recos/buy-can-fin-homes-with-target-price-of-rs-210-sandeep-wagle/articleshow/31450723.cms,
2013-08-29,Sell Can Fin Homes Ltd with a target of Rs 107: Sandeep Wagle,https://economictimes.indiatimes.com/markets/stocks/views/recommendations/sell-can-fin-homes-ltd-with-a-target-of-rs-107-sandeep-wagle/articleshow/22133064.cms,
2016-10-18,Can Fin Homes Q2 net profit up 55.4%,https://economictimes.indiatimes.com/markets/stocks/news/can-fin-homes-q2-net-profit-up-554/articleshow/54920270.cms,
2016-07-17,GST can lower cost of logistics industry by 20 per cent: Care Ratings,https://economictimes.indiatimes.com/industry/transportation/shipping-/-transport/gst-can-lower-cost-of-logistics-industry-by-20-per-cent-care-ratings/articleshow/53251047.cms,
2014-10-17,Hottest gadget deals you can find this Diwali,https://economictimes.indiatimes.com/magazines/panache/hottest-gadget-deals-you-can-find-this-diwali/articleshow/44846244.cms,
2017-09-11,How you can find out what Google knows about you,https://economictimes.indiatimes.com/small-biz/security-tech/technology/how-you-can-find-out-what-google-knows-about-you/articleshow/60456573.cms,
2012-09-01,Indians can find God in Constitution: Chief Justice SH Kapadia,https://economictimes.indiatimes.com/news/politics-and-nation/indians-can-find-god-in-constitution-chief-justice-sh-kapadia/articleshow/16148540.cms,
2016-06-13,"Sell CanFin Homes, target Rs 1157: Geojit BNP Paribas",https://economictimes.indiatimes.com/markets/stocks/recos/sell-canfin-homes-target-rs-1157-geojit-bnp-paribas/articleshow/52726515.cms,
2015-02-05,"India, France can find solution to nuke liability: Laurent Fabius",https://economictimes.indiatimes.com/news/politics-and-nation/india-france-can-find-solution-to-nuke-liability-laurent-fabius/articleshow/46136436.cms,
2016-01-05,One can find enough potential multibaggers beyond top BSE 200 stocks: Ayaz Motiwala,https://economictimes.indiatimes.com/opinion/interviews/one-can-find-enough-potential-multibaggers-beyond-top-bse-200-stocks-ayaz-motiwala/articleshow/50450690.cms,
2012-09-06,"Diesel price hike will send out positive signals: Madan Sabnavis, CARE Ratings",https://economictimes.indiatimes.com/opinion/interviews/diesel-price-hike-will-send-out-positive-signals-madan-sabnavis-care-ratings/articleshow/16281287.cms,
2017-04-12,"Market slumps: REI Agro, Muthoot Capital, Can Fin Homes rally over 7%",https://economictimes.indiatimes.com/markets/stocks/news/market-slumps-rei-agro-muthoot-capital-can-fin-homes-rally-over-7/articleshow/58142794.cms,
2015-07-22,"Prefer HFCs with high retail base; positive on Can Fin Homes, LIC Housing: Gorakssakar",https://economictimes.indiatimes.com/markets/stocks/recos/prefer-hfcs-with-high-retail-base-positive-on-can-fin-homes-lic-housing-gorakssakar/articleshow/48159374.cms,
2016-08-08,CARE Ratings revises rating for Adani Power's bank facilities,https://economictimes.indiatimes.com/markets/stocks/news/care-ratings-revises-rating-for-adani-powers-bank-facilities/articleshow/53596732.cms,
2017-01-09,"Good tax mopup does not equal to growth: Madan Sabnavis, CARE Ratings",https://economictimes.indiatimes.com/markets/expert-view/good-tax-mopup-does-not-equal-to-growth-madan-sabnavis-care-ratings/articleshow/56418374.cms,
2015-07-24,"JP Associates has defaulted, rating cut shows cash flow mismatch: Swati Agrawal, Care Ratings",https://economictimes.indiatimes.com/opinion/interviews/jp-associates-has-defaulted-rating-cut-shows-cash-flow-mismatch-swati-agrawal-care-ratings/articleshow/48198229.cms,
2015-06-05,"Give more weightage to what RBI, IMD say about monsoon and not the Govt: Madan Sabnavis, CARE Ratings",https://economictimes.indiatimes.com/opinion/interviews/give-more-weightage-to-what-rbi-imd-say-about-monsoon-and-not-the-govt-madan-sabnavis-care-ratings/articleshow/47553464.cms,
2014-02-06,"​Expect rupee to hover around 62/63 versus dollar: Madan Sabnavis, CARE Ratings",https://economictimes.indiatimes.com/opinion/interviews/expect-rupee-to-hover-around-62/63-versus-dollar-madan-sabnavis-care-ratings/articleshow/29947892.cms,
2016-09-28,"Next year, expect more flexibility on fiscal deficit target: Madan Sabnavis, CARE Ratings",https://economictimes.indiatimes.com/markets/expert-view/next-year-expect-more-flexibility-on-fiscal-deficit-target-madan-sabnavis-care-ratings/articleshow/54562633.cms,
2012-01-08,Aluminium companies' profits to remain under pressure in Q3: Care Ratings,https://economictimes.indiatimes.com/news/news-by-industry/indl-goods-/-svs/metals-mining/aluminium-companies-profits-to-remain-under-pressure-in-q3-care-ratings/articleshow/11411346.cms,
2016-06-22,"India should be largely insulated from what happens in Brexit: Madan Sabnavis, CARE Ratings",https://economictimes.indiatimes.com/markets/expert-view/india-should-be-largely-insulated-from-what-happens-in-brexit-madan-sabnavis-care-ratings/articleshow/52866522.cms,
2015-04-20,"Rupee stable, let market forces dictate currency direction: Madan Sabnavis, CARE Ratings",https://economictimes.indiatimes.com/opinion/interviews/rupee-stable-let-market-forces-dictate-currency-direction-madan-sabnavis-care-ratings/articleshow/46988013.cms,
2013-01-22,"Expect economy is grow by 5.6% this year: Madan Sabnavis, CARE Ratings",https://economictimes.indiatimes.com/opinion/interviews/expect-economy-is-grow-by-56-this-year-madan-sabnavis-care-ratings/articleshow/18131598.cms,
2015-01-21,Buy Can Fin Homes Ltd with a target of Rs 735: Ashwani Gujral,https://economictimes.indiatimes.com/markets/stocks/recos/buy-can-fin-homes-ltd-with-a-target-of-rs-735-ashwani-gujral/articleshow/45961785.cms,
2015-09-09,Rupee among better performing currencies in 20 sessions after yuan devaluation: Care Ratings,https://economictimes.indiatimes.com/markets/forex/rupee-among-better-performing-currencies-in-20-sessions-after-yuan-devaluation-care-ratings/articleshow/48885634.cms,
2013-03-14,CARE Ratings plans consulting foray,https://economictimes.indiatimes.com/news/news-by-industry/services/consultancy-/-audit/care-ratings-plans-consulting-foray/articleshow/18962041.cms,
2014-10-13,"CPI to remain in 7-8% range for some more time: Madan Sabnavis, CARE Ratings",https://economictimes.indiatimes.com/opinion/interviews/cpi-to-remain-in-7-8-range-for-some-more-time-madan-sabnavis-care-ratings/articleshow/44800181.cms,
2014-02-24,Baring Asia emerges sole bidder for controlling stake in CARE ratings,https://economictimes.indiatimes.com/industry/banking/finance/baring-asia-emerges-sole-bidder-for-controlling-stake-in-care-ratings/articleshow/30916900.cms,
2011-05-03,Investors can find value in IT stocks: UR Bhat,https://economictimes.indiatimes.com/markets/stocks/views/recommendations/investors-can-find-value-in-it-stocks-ur-bhat/articleshow/8150689.cms,
2014-03-18,"​RBI seems to be comfortable with rupee around 61-62/ dollar: Madan Sabnavis, CARE Ratings",https://economictimes.indiatimes.com/opinion/interviews/rbi-seems-to-be-comfortable-with-rupee-around-61-62/-dollar-madan-sabnavis-care-ratings/articleshow/32244266.cms,
2015-03-09,"Expect rupee to remain largely stable around 62 mark: Madan Sabnavis, CARE Ratings",https://economictimes.indiatimes.com/opinion/interviews/expect-rupee-to-remain-largely-stable-around-62-mark-madan-sabnavis-care-ratings/articleshow/46501725.cms,
2017-02-21,"We need more FDI in core manufacturing or core infra: Madan Sabnavis, CARE Ratings",https://economictimes.indiatimes.com/markets/expert-view/we-need-more-fdi-in-core-manufacturing-or-core-infra-madan-sabnavis-care-ratings/articleshow/57270024.cms,
2016-04-11,"Let the markets determine the exchange rate: Madan Sabnavis, CARE Ratings",https://economictimes.indiatimes.com/markets/expert-view/let-the-markets-determine-the-exchange-rate-madan-sabnavis-care-ratings/articleshow/51777435.cms,
2016-12-28,Soccer-Fortuna hope Sunday driver can find rapid road to success,https://economictimes.indiatimes.com/news/sports/soccer-fortuna-hope-sunday-driver-can-find-rapid-road-to-success/articleshow/56215690.cms,
2013-07-02,"Don’t expect RBI to cut rates until rupee stabilizes: Madan Sabnavis, CARE Ratings",https://economictimes.indiatimes.com/opinion/interviews/dont-expect-rbi-to-cut-rates-until-rupee-stabilizes-madan-sabnavis-care-ratings/articleshow/20877056.cms,
2016-07-14,Can Fin Homes April -June net profit rises 55 per cent to Rs 50 crore,https://economictimes.indiatimes.com/markets/stocks/earnings/can-fin-homes-april-june-net-profit-rises-55-per-cent-to-rs-50-crore/articleshow/53213673.cms,
2014-09-11,Focus on faster delivery helps CanFin Homes take on rivals,https://economictimes.indiatimes.com/markets/stocks/news/focus-on-faster-delivery-helps-canfin-homes-take-on-rivals/articleshow/42224888.cms,
2015-01-12,"Demand conditions need to revive for pick up in investment: Madan Sabnavis, CARE Ratings",https://economictimes.indiatimes.com/opinion/interviews/demand-conditions-need-to-revive-for-pick-up-in-investment-madan-sabnavis-care-ratings/articleshow/45851706.cms,
2017-05-22,NPAs increasing in PSU banks: CARE Ratings Report,https://economictimes.indiatimes.com/wealth/personal-finance-news/npas-increasing-in-psu-banks-care-ratings-report/articleshow/58761958.cms,
2016-11-23,"We will divest 13% stake in Can Fin Homes: Rakesh Sharma, Canara Bank",https://economictimes.indiatimes.com/markets/expert-view/we-will-divest-13-stake-in-can-fin-homes-rakesh-sharma-canara-bank/articleshow/55574171.cms,
2013-02-18,"In Budget 2013 investors eye road to fiscal reforms: DR Dogra, CARE Ratings & Research",https://economictimes.indiatimes.com/opinion/comments-analysis/in-budget-2013-investors-eye-road-to-fiscal-reforms-dr-dogra-care-ratings-research/articleshow/18558226.cms,
2012-12-05,Care Ratings to set up global unit, in pact with 4 partners,https://economictimes.indiatimes.com/news/news-by-industry/banking/finance/care-ratings-to-set-up-global-unit-in-pact-with-4-partners/articleshow/17494701.cms
2016-08-25,"No new trigger, India to continue on 7.6-7.8% growth path: Madan Sabnavis, CARE Ratings",https://economictimes.indiatimes.com/markets/expert-view/no-new-trigger-india-to-continue-on-76-78-growth-path-madan-sabnavis-care-ratings/articleshow/53857690.cms,
2016-11-16,Buy  Can Fin Homes with a target of Rs  1600:  Ashish Maheshwari,https://economictimes.indiatimes.com/markets/stocks/recos/buy-can-fin-homes-with-a-target-of-rs-1600-ashish-maheshwari/articleshow/55453602.cms,
2012-02-22,Bank of Baroda and Care Rating ink pact for MSMEs,https://economictimes.indiatimes.com/news/news-by-industry/banking/finance/banking/bank-of-baroda-and-care-rating-ink-pact-for-msmes/articleshow/11992265.cms,
2015-12-28,"2016 is going to spell good news for Indian economy: Madan Sabnavis, CARE Ratings",https://economictimes.indiatimes.com/opinion/interviews/2016-is-going-to-spell-good-news-for-indian-economy-madan-sabnavis-care-ratings/articleshow/50352678.cms,
2016-07-27,"Government should spend more and go beyond 3.5% target: Madan Sabnavis, CARE Ratings",https://economictimes.indiatimes.com/markets/expert-view/government-should-spend-more-and-go-beyond-35-target-madan-sabnavis-care-ratings/articleshow/53413916.cms,
2016-02-01,Indian manufacturing companies improve performance in Q3: CARE Ratings,https://economictimes.indiatimes.com/news/economy/indicators/indian-manufacturing-companies-improve-performance-in-q3-care-ratings/articleshow/50807669.cms,
2014-02-10,"Buyout PE funds like Actis, Apax Partners in race to take control of CARE ratings",https://economictimes.indiatimes.com/industry/banking/finance/buyout-pe-funds-like-actis-apax-partners-in-race-to-take-control-of-care-ratings/articleshow/30129536.cms,
2016-07-25,"First quarter credit quality was the poorest in two years, says CARE Ratings",https://economictimes.indiatimes.com/news/economy/finance/first-quarter-credit-quality-was-the-poorest-in-two-years-says-care-ratings/articleshow/53378964.cms,
2016-02-13,"Government compunding problems by tackling banks' NPA issues now: Madan Sabnavis, CARE Ratings",https://economictimes.indiatimes.com/markets/expert-view/government-compunding-problems-by-tackling-banks-npa-issues-now-madan-sabnavis-care-ratings/articleshow/50959229.cms,
2014-05-05,Credit Analysis & Research gets nod for hiking FII stake limit,https://economictimes.indiatimes.com/industry/banking/finance/credit-analysis-research-gets-nod-for-hiking-fii-stake-limit/articleshow/34695984.cms,
2015-02-19,"Expect Govt to target 8% GDP growth for next year: Madan Sabnavis, CARE Ratings",https://economictimes.indiatimes.com/opinion/interviews/expect-govt-to-target-8-gdp-growth-for-next-year-madan-sabnavis-care-ratings/articleshow/46298403.cms,
2015-07-16,"Weaker rupee won't help exports much unless global economy recovers: Madan Sabnavis, CARE Ratings",https://economictimes.indiatimes.com/opinion/interviews/weaker-rupee-wont-help-exports-much-unless-global-economy-recovers-madan-sabnavis-care-ratings/articleshow/48097395.cms,
2014-12-05,"See reversal of interest rates irrespective of what RBI does: Madan Sabnavis, CARE Ratings",https://economictimes.indiatimes.com/opinion/interviews/see-reversal-of-interest-rates-irrespective-of-what-rbi-does-madan-sabnavis-care-ratings/articleshow/45383985.cms,
2016-08-02,CARE Ratings reaffirms credit rating of Indiabulls Real Estate,https://economictimes.indiatimes.com/markets/stocks/news/care-ratings-reaffirms-credit-rating-of-indiabulls-real-estate/articleshow/53509294.cms,
2015-09-24,"GMR, SREI Infra drop as CARE Ratings cuts ratings for long-term loans",https://economictimes.indiatimes.com/markets/stocks/news/gmr-srei-infra-drop-as-care-ratings-cuts-ratings-for-long-term-loans/articleshow/49085425.cms,
2015-05-08,"Care Ratings sees rupee falling to 65, forcing RBI governor Raghuram Rajan to hold rates in June",https://economictimes.indiatimes.com/markets/forex/care-ratings-sees-rupee-falling-to-65-forcing-rbi-governor-raghuram-rajan-to-hold-rates-in-june/articleshow/47206521.cms,
2011-12-08,People's participation can find solution to Naxalism: Arjun Munda,https://economictimes.indiatimes.com/news/politics/nation/peopleamp39s-participation-can-find-solution-to-naxalism-arjun-munda/articleshow/11030043.cms,
2013-11-21,"India to retain top rice exporter rank, says CARE Ratings",https://economictimes.indiatimes.com/news/economy/foreign-trade/india-to-retain-top-rice-exporter-rank-says-care-ratings/articleshow/26162316.cms,
2013-10-08,"Reduction in MSF rates is good news for banks: Madan Sabnavis, CARE Ratings",https://economictimes.indiatimes.com/opinion/interviews/reduction-in-msf-rates-is-good-news-for-banks-madan-sabnavis-care-ratings/articleshow/23727667.cms,
2012-12-03,"We have plans to go international now: DR Dogra, MD, Care Ratings",https://economictimes.indiatimes.com/markets/ipos/fpos/rights-issues/we-have-plans-to-go-international-now-dr-dogra-md-care-ratings/articleshow/17465101.cms,
2012-10-23,"Growth will remain subdued for rest of the year: Madan Sabnavis, CARE Ratings",https://economictimes.indiatimes.com/opinion/interviews/growth-will-remain-subdued-for-rest-of-the-year-madan-sabnavis-care-ratings/articleshow/16927065.cms,
2017-06-14,"All our econometric models which we draw for projecting inflation have gone for a toss: Madan Sabnavis, Chief Economist, CARE Ratings.",https://economictimes.indiatimes.com/markets/expert-view/all-our-econometric-models-which-we-draw-for-projecting-inflation-have-gone-for-a-toss-madan-sabnavis-chief-economist-care-ratings/articleshow/59143818.cms,
2014-05-23,Poor demand shaves off top companies' profit, margin by 37% in FY14: Care Ratings,https://economictimes.indiatimes.com/markets/stocks/earnings/poor-demand-shaves-off-top-companies-profit-margin-by-37-in-fy14-care-ratings/articleshow/35522010.cms
2015-05-14,RBI may cut rates by 0.25 percentage points in policy review: Care Ratings,https://economictimes.indiatimes.com/news/economy/finance/rbi-may-cut-rates-by-025-percentage-points-in-policy-review-care-ratings/articleshow/47286452.cms,
