date,data,url,
2012-07-16,South Indian Bank Q1 net up 49.17%,http://www.thehindubusinessline.com/money-and-banking/south-indian-bank-q1-net-up-4917/article3646564.ece,
2011-04-07,"South Indian Bank posts Rs 50,560 cr turnover in 2010-11",http://www.thehindubusinessline.com/money-and-banking/south-indian-bank-posts-rs-50560-cr-turnover-in-201011/article1608169.ece,
2014-02-02,South Indian Bank anniversary,http://www.thehindubusinessline.com/companies/south-indian-bank-anniversary/article5645997.ece,
2011-11-05,South Indian Bank: Buy,http://premium.thehindubusinessline.com/portfolio/firm-calls/south-indian-bank-buy/article2601266.ece,
2015-05-05,South Indian Bank reports 40% drop in FY’15 net,http://www.thehindubusinessline.com/money-and-banking/south-indian-bank-reports-40-drop-in-fy15-net/article7173650.ece,
2017-03-07,South Indian Bank shares jump over 3%,http://www.thehindubusinessline.com/markets/stock-markets/south-indian-bank-jumps-over-3/article9573509.ece,
2017-07-11,South Indian Bank net up 7% in first quarter,http://www.thehindubusinessline.com/money-and-banking/south-indian-bank-net-up-7-in-first-quarter/article9760652.ece,
2014-07-25,"No further FII purchases allowed in Repco Home, South Indian Bank",http://www.thehindubusinessline.com/money-and-banking/no-further-fii-purchases-allowed-in-repco-home-south-indian-bank/article6249882.ece,
2012-05-07,South Indian Bank Q4 profit up 49% on better yield on advances,http://www.thehindubusinessline.com/money-and-banking/south-indian-bank-q4-profit-up-49-on-better-yield-on-advances/article3394546.ece,
2016-11-24,South Indian Bank launches contactless debit card,http://www.thehindubusinessline.com/money-and-banking/south-indian-bank-launches-contactless-debit-card/article9382427.ece,
2011-05-02,"South Indian Bank raising Rs 1,000 cr for capex, NBFC plans",http://www.thehindubusinessline.com/money-and-banking/south-indian-bank-raising-rs-1000-cr-for-capex-nbfc-plans/article1985605.ece,
2017-04-04,Capital-raising a success: SIB,http://www.thehindubusinessline.com/money-and-banking/south-indian-bank-and-fund-raising/article9616166.ece,
2013-09-18,South Indian Bank ties up with Regional Cancer Centre,http://www.thehindubusinessline.com/news/national/south-indian-bank-ties-up-with-regional-cancer-centre/article5142434.ece,
2014-01-16,South Indian Bank net rises 10.2%,http://www.thehindubusinessline.com/money-and-banking/south-indian-bank-net-rises-102/article5583158.ece,
2015-07-16,Poor show by South Indian Bank drags the stock down,http://www.thehindubusinessline.com/markets/poor-show-by-south-indian-bank-drags-the-stock-down/article7429328.ece,
2012-12-10,South Indian Bank eyeing 25% growth this fiscal,http://www.thehindubusinessline.com/money-and-banking/south-indian-bank-eyeing-25-growth-this-fiscal/article4184089.ece,
2011-08-04,Award for South Indian Bank,http://www.thehindubusinessline.com/money-and-banking/award-for-south-indian-bank/article2322600.ece,
2011-10-07,South Indian Bank title sponsors for GKSF ,http://www.thehindubusinessline.com/companies/south-indian-bank-title-sponsors-for-gksf/article2518319.ece,
2013-04-06,South Indian Bank clarifies,http://www.thehindubusinessline.com/money-and-banking/south-indian-bank-clarifies/article4587995.ece,
2013-08-06,Three arrested in South Indian Bank appointment scam ,http://www.thehindubusinessline.com/money-and-banking/three-arrested-in-south-indian-bank-appointment-scam/article4995552.ece,
2012-10-19,South Indian Bank net up 24% in H1 as interest margin improves ,http://www.thehindubusinessline.com/money-and-banking/south-indian-bank-net-up-24-in-h1-as-interest-margin-improves/article4013680.ece,
2014-08-31,Book on South Indian Bank,http://www.thehindubusinessline.com/news/national/book-on-south-indian-bank/article6367008.ece,
2012-04-01,South Indian Bank announces new deposit schemes,http://www.thehindubusinessline.com/money-and-banking/south-indian-bank-announces-new-deposit-schemes/article3268804.ece,
2014-04-21,FIIs allowed buying addl shares in South Indian Bank,http://www.thehindubusinessline.com/markets/fiis-allowed-buying-addl-shares-in-south-indian-bank/article5934328.ece,
2012-09-01,South Indian Bank: Buy,http://premium.thehindubusinessline.com/portfolio/firm-calls/south-indian-bank-buy/article3848233.ece,
2014-09-19,South Indian Bank plans to raise ₹500 crore via QIP,http://www.thehindubusinessline.com/money-and-banking/south-indian-bank-plans-to-raise-rs-500-cr-via-qip/article6426601.ece,
2016-03-23,South Indian Bank gets ISO 9001:2008 certification,http://www.thehindubusinessline.com/money-and-banking/south-indian-bank-gets-iso-90012008-certification/article8389547.ece,
2012-10-01,New South Indian Bank branches in Palakkad region,http://www.thehindubusinessline.com/money-and-banking/new-south-indian-bank-branches-in-palakkad-region/article3955240.ece,
2016-07-08,South Indian Bank Q1 net profit rises 46%,http://www.thehindubusinessline.com/money-and-banking/south-indian-bank-q1-net-jumps-46-stocks-spurt-22/article8824096.ece,
2016-07-25,"South Indian Bank launches prepaid, gift cards ",http://www.thehindubusinessline.com/money-and-banking/south-indian-bank-launches-prepaid-gift-cards/article8897774.ece,
2015-06-25,South Indian Bank launches new mobile app ,http://www.thehindubusinessline.com/money-and-banking/south-indian-bank-launches-new-mobile-app/article7354380.ece,
2017-03-24,South Indian Bank rolls out mobile app linked to Aadhaar,http://www.thehindubusinessline.com/money-and-banking/south-indian-bank-rolls-out-mobile-app-linked-to-aadhaar/article9600750.ece,
2017-03-23,South Indian Bank introduces Aadhar-based payment app,http://www.thehindubusinessline.com/money-and-banking/south-indian-bank-introduces-aadharbased-payment-app/article9598208.ece,
2016-12-20,South Indian Bank board meets to consider rights issue,http://www.thehindubusinessline.com/markets/stock-markets/south-indian-bank-board-meets-to-consider-rights-issue/article9436561.ece,
2017-04-07,"South Indian Bank, Flyworld Money in pact for remittances",http://www.thehindubusinessline.com/money-and-banking/south-indian-bank-ties-up-with-exchange-house-in-australia/article9622781.ece,
2013-04-22,Kochi: South Indian Bank wins cricket tournament,http://www.thehindubusinessline.com/news/national/kochi-south-indian-bank-wins-cricket-tournament/article4643707.ece,
2014-11-26,John Tharakan is South Indian Bank additional director,http://www.thehindubusinessline.com/money-and-banking/john-tharakan-is-south-indian-bank-additional-director/article6635295.ece,
2017-02-21,South Indian Bank rights issue opens on Feb 28 ,http://www.thehindubusinessline.com/markets/stock-markets/south-indian-bank-rights-issue-opens-on-feb-28/article9553416.ece,
2013-03-27,"South Indian Bank achieves Rs 75,000-cr biz target",http://www.thehindubusinessline.com/money-and-banking/south-indian-bank-achieves-rs-75000cr-biz-target/article4554887.ece,
2017-07-06,South Indian Bank ties up with PFG Forex,http://www.thehindubusinessline.com/money-and-banking/south-indian-bank-ties-up-with-pfg-forex/article9751891.ece,
2011-12-12,South Indian Bank to open corporate finance branches,http://www.thehindubusinessline.com/money-and-banking/south-indian-bank-to-open-corporate-finance-branches/article2709637.ece,
2011-04-03,We have maintained 30% growth over last 5-6 years: South Indian Bank MD,http://www.thehindubusinessline.com/money-and-banking/we-have-maintained-30-growth-over-last-56-years-south-indian-bank-md/article1596771.ece,
2014-07-25,"RBI freezes FII exposure in Repco, South Indian Bank",http://www.thehindubusinessline.com/markets/stock-markets/rbi-freezes-fii-exposure-in-repco-south-indian-bank/article6249925.ece,
2012-09-11,South Indian Bank raises Rs 443 cr via QIP issue,http://www.thehindubusinessline.com/markets/south-indian-bank-raises-rs-443-cr-via-qip-issue/article3885537.ece,
2016-05-08,South Indian Bank announces tie-up with National Australia Bank,http://www.thehindubusinessline.com/money-and-banking/south-indian-bank-announces-tieup-with-national-australia-bank/article8572898.ece,
2013-10-17,South Indian Bank Q2 net soars 30.5% on hefty margins,http://www.thehindubusinessline.com/money-and-banking/south-indian-bank-q2-net-soars-305-on-hefty-margins/article5243855.ece,
2015-10-17,South Indian Bank Q2 net up 22.4% ,http://www.thehindubusinessline.com/money-and-banking/south-indian-bank-q2-net-up-224/article7774285.ece,
2014-06-10,South Indian Bank gross NPA declines,http://www.thehindubusinessline.com/companies/south-indian-bank-gross-npa-declines/article6101611.ece,
2015-06-03,South Indian Bank to raise FDI limit by 10%,http://www.thehindubusinessline.com/money-and-banking/south-indian-bank-to-raise-fdi-limit-by-10/article7278382.ece,
2011-12-28,Govt to ask Sterlite for formal plan for buying 49% residual stake in Balco,http://www.thehindubusinessline.com/companies/govt-to-ask-sterlite-for-formal-plan-for-buying-49-residual-stake-in-balco/article2755339.ece,
2012-02-15,US court orders Sterlite to pay $83 m in Asarco deal case,http://www.thehindubusinessline.com/companies/us-court-orders-sterlite-to-pay-83-m-in-asarco-deal-case/article2895776.ece,
2012-01-19,Sterlite Grid orders transmission lines ,http://www.thehindubusinessline.com/companies/sterlite-grid-orders-transmission-lines/article2814827.ece,
2016-11-03,Sterlite Technologies board approves 25% interim dividend,http://www.thehindubusinessline.com/markets/sterlite-technologies-board-approves-25-interim-dividend/article9300466.ece,
2011-04-04, Sterlite gets letter of intent for transmission ventures ,http://www.thehindubusinessline.com/companies/sterlite-gets-letter-of-intent-for-transmission-ventures/article1599376.ece,
2011-04-21,"Niyamgiri mining project: Apex court issues notice to MoEF, Orissa Govt, Sterlite",http://www.thehindubusinessline.com/economy/niyamgiri-mining-project-apex-court-issues-notice-to-moef-orissa-govt-sterlite/article1714637.ece,
2015-04-28,"Sesa Sterlite, HDFC numbers awaited",http://www.thehindubusinessline.com/markets/stock-markets/sesa-sterlite-hdfc-numbers-awaited/article7151209.ece,
2016-06-03,"Sterlite Power plans ₹2,500-crore mop up via infra investment trusts",http://www.thehindubusinessline.com/markets/stock-markets/sterlite-power-plans-2500crore-mop-up-via-infra-investment-trusts/article8687273.ece,
2012-12-28,Sterlite to add another 80 MW in Tuticorin,http://www.thehindubusinessline.com/companies/sterlite-to-add-another-80-mw-in-tuticorin/article4248205.ece,
2015-10-26,Sterlite Technologies net profit doubles to Rs 29.4 cr,http://www.thehindubusinessline.com/info-tech/sterlite-technologies-net-profit-doubles-to-rs-29-cr/article7805817.ece,
2017-05-08,"Sterlite Power to raise ₹2,650 crthrough InvIT; launch on May 17",http://www.thehindubusinessline.com/companies/sterlite-power-to-raise-2650-crthrough-invit-launch-on-may-17/article9686835.ece,
2012-09-27,"SAIL, Sterlite down 2% on exit from Nifty index ",http://www.thehindubusinessline.com/markets/stock-markets/sail-sterlite-down-2-on-exit-from-nifty-index/article3941774.ece,
2013-03-30,Sterlite copper plant in TN shut down after gas leak ,http://www.thehindubusinessline.com/companies/sterlite-copper-plant-in-tn-shut-down-after-gas-leak/article4564025.ece,
2011-04-25,"Sterlite Q4 profit up 35% at Rs 1,925 cr",http://www.thehindubusinessline.com/companies/sterlite-q4-profit-up-35-at-rs-1925-cr/article1766560.ece,
2015-01-30,Sterlite develops tech to test 10-50 Tbps data transmission,http://www.thehindubusinessline.com/companies/sterlite-develops-tech-to-test-1050-tbps-data-transmission/article6838811.ece,
2013-12-26,"Sterlite, GMR among firms to get temporary coal supply",http://www.thehindubusinessline.com/companies/sterlite-gmr-among-firms-to-get-temporary-coal-supply/article5504434.ece,
2013-01-29,Sterlite net up 30% ,http://www.thehindubusinessline.com/companies/sterlite-net-up-30/article4357312.ece,
2014-05-20,Sesa Sterlite up nearly 8% on NSE,http://www.thehindubusinessline.com/markets/stock-markets/sesa-sterlite-up-nearly-8-on-nse/article6028088.ece,
2013-02-22,"Sterlite Copper lines up Rs 3,300 cr investments in next 2 years",http://www.thehindubusinessline.com/companies/sterlite-copper-lines-up-rs-3300-cr-investments-in-next-2-years/article4442992.ece,
2013-03-31,Pollution issues to keep Sterlite in focus,http://www.thehindubusinessline.com/markets/stock-markets/pollution-issues-to-keep-sterlite-in-focus/article4567127.ece,
2013-03-28,"Vaiko, others arrested for attempting to lay siege to Sterlite plant",http://www.thehindubusinessline.com/news/national/vaiko-others-arrested-for-attempting-to-lay-siege-to-sterlite-plant/article4557780.ece,
2013-04-09,Sterlite plea against pollution board’s order posted for April 12,http://www.thehindubusinessline.com/companies/sterlite-plea-against-pollution-boards-order-posted-for-april-12/article4598290.ece,
2015-01-19, Sterlite to restart mining in Goa in 2 weeks,http://www.thehindubusinessline.com/companies/sterlite-to-restart-mining-in-goa-in-2-weeks/article6802512.ece,
2014-09-30,Sterlite Technologies ties up with Japanese co Viscas,http://www.thehindubusinessline.com/companies/sterlite-technologies-ties-up-with-japanese-co-viscas/article6460070.ece,
2012-12-23,Sterlite Copper wins Assocham appreciation award,http://www.thehindubusinessline.com/companies/sterlite-copper-wins-assocham-appreciation-award/article4232280.ece,
2014-07-22,"BSE, NSE clear merger of two arms with Sesa Sterlite",http://www.thehindubusinessline.com/markets/stock-markets/bse-nse-clear-merger-of-two-arms-with-sesa-sterlite/article6238209.ece,
2012-04-25,Sterlite consolidated net down 27% in fourth quarter ,http://www.thehindubusinessline.com/companies/sterlite-consolidated-net-down-27-in-fourth-quarter/article3353337.ece,
2013-04-11,Sterlite Tech bags orders worth Rs 630 cr,http://www.thehindubusinessline.com/companies/sterlite-tech-bags-orders-worth-rs-630-cr/article4606869.ece,
2013-12-30,Sesa Sterlite resumes mining operations in Karnataka ,http://www.thehindubusinessline.com/companies/sesa-sterlite-resumes-mining-operations-in-karnataka/article5519058.ece,
2013-11-07,Sesa Sterlite up nearly 2% in early trade,http://www.thehindubusinessline.com/markets/stock-markets/sesa-sterlite-up-nearly-2-in-early-trade/article5324951.ece,
2011-07-25,Drop in copper output drags Sterlite Ind net down 18%,http://www.thehindubusinessline.com/companies/drop-in-copper-output-drags-sterlite-ind-net-down-18/article2293355.ece,
2011-08-23,Apex court to hear Sterlite case only in January next,http://www.thehindubusinessline.com/economy/apex-court-to-hear-sterlite-case-only-in-january-next/article2389469.ece,
2011-08-25,Sterlite Tech bags Rs 225-cr order from PowerGrid,http://www.thehindubusinessline.com/companies/sterlite-tech-bags-rs-225cr-order-from-powergrid/article2396008.ece,
2013-09-20,Sterlite Grid bags transmission projects worth Rs 650 cr,http://www.thehindubusinessline.com/companies/sterlite-grid-bags-transmission-projects-worth-rs-650-cr/article5149951.ece,
2011-10-12,Sterlite allocates funds to address ‘deficiencies' ,http://www.thehindubusinessline.com/companies/sterlite-allocates-funds-to-address-deficiencies/article2531597.ece,
2014-07-16,Sesa Sterlite merger in apex court,http://www.thehindubusinessline.com/markets/stock-markets/sesa-sterlite-merger-in-apex-court/article6217975.ece,
2015-04-10,"Sesa Sterlite iron ore, oil output dips in FY’15 ",http://www.thehindubusinessline.com/companies/sesa-sterlite-iron-ore-oil-output-dips-in-fy15/article7089501.ece,
2011-09-21,Sterlite Technology shares up by over 4% on BSE,http://www.thehindubusinessline.com/markets/stock-markets/sterlite-technology-shares-up-by-over-4-on-bse/article2473220.ece,
2011-04-25,Sterlite surges over 4% on robust Q4 earnings,http://www.thehindubusinessline.com/markets/stock-markets/sterlite-surges-over-4-on-robust-q4-earnings/article1766379.ece,
2014-09-04,Sesa Sterlite: showing mettle under debt load,http://www.thehindubusinessline.com/companies/sesa-sterlite-showing-mettle-under-debt-load/article6380337.ece,
2012-10-23,"Sterlite Ind net rises 75% to Rs 1,743 cr on forex gains",http://www.thehindubusinessline.com/companies/sterlite-ind-net-rises-75-to-rs-1743-cr-on-forex-gains/article4026070.ece,
2013-01-05,QUERY CORNER - Sterlite Industries trying to build a base,http://premium.thehindubusinessline.com/portfolio/market-strategy/query-corner-sterlite-industries-trying-to-build-a-base/article4276800.ece,
2014-01-20,Sterlite banking big on by-products ,http://www.thehindubusinessline.com/companies/sterlite-banking-big-on-byproducts/article5597885.ece,
2015-07-01,Sterlite pledges mega investment ,http://www.thehindubusinessline.com/news/sterlite-pledges-mega-investment/article7375480.ece,
2011-09-21,Sterlite bags Rs 114 cr order from BSNL ,http://www.thehindubusinessline.com/companies/sterlite-bags-rs-114-cr-order-from-bsnl/article2472781.ece,
2016-06-13,Sterlite Power files papers for InvITs,http://www.thehindubusinessline.com/markets/stock-markets/sterlite-power-files-papers-for-invits/article8724809.ece,
2014-12-04,Sesa Sterlite gets award from Russian Govt,http://www.thehindubusinessline.com/companies/sesa-sterlite-gets-award-from-russian-govt/article6661529.ece,
2012-08-17,"SAIL, Sterlite fall; Lupin, UltraTech gain on Nifty changes ",http://www.thehindubusinessline.com/markets/stock-markets/sail-sterlite-fall-lupin-ultratech-gain-on-nifty-changes/article3784311.ece,
2011-10-11,Stay on Sterlite plant closure extended,http://www.thehindubusinessline.com/companies/stay-on-sterlite-plant-closure-extended/article2529051.ece,
2011-08-23,SC refuses early hearing to Orissa on Sterlite case,http://www.thehindubusinessline.com/companies/sc-refuses-early-hearing-to-orissa-on-sterlite-case/article2388231.ece,
2015-01-29,"Sesa Sterlite net falls 15% as metal, energy prices dip",http://www.thehindubusinessline.com/companies/sesa-sterlite-net-falls-15-as-metal-energy-prices-dip/article6835336.ece,
2015-05-18,Sterlite Tech to spin off power biz into unlisted firm,http://www.thehindubusinessline.com/companies/sterlite-tech-to-spin-off-power-biz-into-unlisted-firm/article7220315.ece,
2013-04-12,National Green Tribunal asks Sterlite Copper to halt operations,http://www.thehindubusinessline.com/companies/national-green-tribunal-asks-sterlite-copper-to-halt-operations/article4610328.ece,
2012-02-15,Sterlite Ind shares up on lower payout to Asarco,http://www.thehindubusinessline.com/companies/sterlite-ind-shares-up-on-lower-payout-to-asarco/article2897218.ece,
2012-01-08,Sterlite set to bid for remaining Balco stake,http://www.thehindubusinessline.com/companies/sterlite-set-to-bid-for-remaining-balco-stake/article2785658.ece,
2014-07-29,Sesa Sterlite clocks Rs 376 cr net in Q1,http://www.thehindubusinessline.com/companies/sesa-sterlite-clocks-rs-376-cr-net-in-q1/article6261029.ece,
2013-07-18,Sterlite Tech launches bend-insensitive fibres,http://www.thehindubusinessline.com/companies/sterlite-tech-launches-bendinsensitive-fibres/article4927115.ece,
2012-06-25,"Sterlite, Sesa Goa get shareholder nod for merger",http://www.thehindubusinessline.com/companies/sterlite-sesa-goa-get-shareholder-nod-for-merger/article3568320.ece,
2012-06-19,"Sterlite Tech raises Rs 2,200-cr debt for grid projects",http://www.thehindubusinessline.com/companies/sterlite-tech-raises-rs-2200cr-debt-for-grid-projects/article3547420.ece,
2014-03-31,Mukherjee quits, Anil Agarwal is Chairman Emeritus at Sesa Sterlite,http://www.thehindubusinessline.com/companies/mukherjee-quits-anil-agarwal-is-chairman-emeritus-at-sesa-sterlite/article5855545.ece
2011-04-25,"Zinc, copper and silver lift Sterlite profits ",http://www.thehindubusinessline.com/companies/zinc-copper-and-silver-lift-sterlite-profits/article1766555.ece,
2013-05-31,Sterlite Copper hopes to achieve full capacity a week after restart,http://www.thehindubusinessline.com/companies/sterlite-copper-hopes-to-achieve-full-capacity-a-week-after-restart/article4769204.ece,
2012-01-05,Sterlite Grid seeks FIPB nod to invest in power transmission projects,http://www.thehindubusinessline.com/companies/sterlite-grid-seeks-fipb-nod-to-invest-in-power-transmission-projects/article2777959.ece,
2013-04-16,Decision on Sterlite after green tribunal’s verdict: TN Govt,http://www.thehindubusinessline.com/news/national/decision-on-sterlite-after-green-tribunals-verdict-tn-govt/article4623558.ece,
2016-07-25,Sterlite Tech Q1 profit up 29% ,http://www.thehindubusinessline.com/companies/sterlite-tech-q1-profit-up-29/article8897771.ece,
2013-07-10,Sterlite forges joint venture with Brazilian company for optical fibre ,http://www.thehindubusinessline.com/companies/sterlite-forges-joint-venture-with-brazilian-company-for-optical-fibre/article4901243.ece,
2012-09-11,"Pfizer, Sterlite Networks among 21 FDI proposals cleared ",http://www.thehindubusinessline.com/economy/pfizer-sterlite-networks-among-21-fdi-proposals-cleared/article3885551.ece,
2016-02-17,Sterlite Grid to deploy Aircrane helicopters for J&K power transmission project,http://www.thehindubusinessline.com/companies/sterlite-grid-to-deploy-aircrane-helicopters-for-jk-power-transmission-project/article8248883.ece,
2015-02-20,Sesa Sterlite may be renamed Vedanta Ltd,http://www.thehindubusinessline.com/companies/sesa-sterlite-may-be-renamed-vedanta-ltd/article6916993.ece,
2013-04-30,Sterlite net profit surges 51% on higher volumes,http://www.thehindubusinessline.com/companies/sterlite-net-profit-surges-51-on-higher-volumes/article4669939.ece,
2011-03-05,Sterlite Tech clarifies,http://www.thehindubusinessline.com/companies/sterlite-tech-clarifies/article1512731.ece,
2017-03-01,InvIT: Sterlite Power to get SEBI nod today,http://www.thehindubusinessline.com/markets/stock-markets/sterlite-power-invit/article9565872.ece,
2013-04-02,"Pay Rs 100 cr for pollution, apex court tells Sterlite",http://www.thehindubusinessline.com/markets/pay-rs-100-cr-for-pollution-apex-court-tells-sterlite/article4573831.ece,
2012-06-17,"Sesa Goa, Sterlite to meet on proposed merger ",http://www.thehindubusinessline.com/companies/sesa-goa-sterlite-to-meet-on-proposed-merger/article3539420.ece,
2014-10-08,Sesa Sterlite expects Goa iron ore mining to resume early next year,http://www.thehindubusinessline.com/companies/sesa-sterlite-expects-goa-iron-ore-mining-to-resume-early-next-year/article6480752.ece,
2016-01-28,Sterlite Tech Q3 net rises 82% to ₹42 crore,http://www.thehindubusinessline.com/info-tech/sterlite-tech-q3-net-rises-82-to-42-crore/article8163617.ece,
2015-05-18,Sterlite to demerge power biz into a separate unlisted company,http://www.thehindubusinessline.com/companies/sterlite-to-demerge-power-biz/article7219332.ece,
2012-02-25,"Vedanta to merge Sesa Goa, Sterlite Ind in all-share deal",http://www.thehindubusinessline.com/companies/vedanta-to-merge-sesa-goa-sterlite-ind-in-allshare-deal/article2931666.ece,
2014-10-14,Sesa Sterlite stock seesaws on apex court order and firm’s clarification,http://www.thehindubusinessline.com/markets/stock-markets/sesa-sterlite-shares-slump-on-court-order-on-goa-iron-ore-mining/article6499600.ece,
2013-04-01,Sterlite seeks Tamil Nadu CM’s help to restart Tuticorin plant,http://www.thehindubusinessline.com/companies/sterlite-seeks-tamil-nadu-cms-help-to-restart-tuticorin-plant/article4570375.ece,
2013-11-21,Sesa Sterlite sets record date for paying interest on NCDs ,http://www.thehindubusinessline.com/markets/sesa-sterlite-sets-record-date-for-paying-interest-on-ncds/article5375717.ece,
2017-03-25,Sterlite Technologies: Connecting the digital dots,http://premium.thehindubusinessline.com/portfolio/sterlite-technologies-connecting-the-digital-dots/article9601318.ece,
2015-04-27,Sesa Sterlite gains on rebound in iron ore prices,http://www.thehindubusinessline.com/markets/stock-markets/sesa-sterlite-gains-on-rebound-in-iron-ore-prices/article7146228.ece,
2013-04-02,Sterlite Industries welcomes SC verdict,http://www.thehindubusinessline.com/companies/sterlite-industries-welcomes-sc-verdict/article4573371.ece,
2011-10-02,Sterlite Copper commissions railway siding at Tuticorin,http://www.thehindubusinessline.com/companies/sterlite-copper-commissions-railway-siding-at-tuticorin/article2506248.ece,
2013-04-02,Apex court asks Sterlite Industries to pay Rs 100 cr fine,http://www.thehindubusinessline.com/companies/apex-court-asks-sterlite-industries-to-pay-rs-100-cr-fine/article4572713.ece,
2012-01-21,QUERY CORNER: Sterlite Ind reversing from long-term support,http://premium.thehindubusinessline.com/portfolio/market-strategy/query-corner-sterlite-ind-reversing-from-longterm-support/article2820557.ece,
2014-05-01,"Sesa Sterlite not to lay off 1,017 employees on notice ",http://www.thehindubusinessline.com/companies/sesa-sterlite-not-to-lay-off-1017-employees-on-notice/article5966205.ece,
2013-08-17,"Sesa Goa, Sterlite merger becomes effective",http://www.thehindubusinessline.com/companies/sesa-goa-sterlite-merger-becomes-effective/article5032582.ece,
2014-07-01,"Sterlite Tech bags Rs 2,500 cr BSNL order",http://www.thehindubusinessline.com/companies/sterlite-tech-bags-rs-2500-cr-bsnl-order/article6166995.ece,
2011-03-18,Award for Sterlite Copper,http://www.thehindubusinessline.com/companies/award-for-sterlite-copper/article1550299.ece,
2011-08-01,Sterlite project: Apex court notice to Environment Ministry,http://www.thehindubusinessline.com/economy/sterlite-project-apex-court-notice-to-environment-ministry/article2314147.ece,
2012-02-25,Sesa Sterlite: What drove the deal,http://www.thehindubusinessline.com/companies/sesa-sterlite-what-drove-the-deal/article2932573.ece,
2016-10-05,Sterlite Power readies $5-7 b investment in transmission business,http://www.thehindubusinessline.com/companies/sterlite-power-aims-to-invest-57-bn-in-transmission-biz/article9188580.ece,
