date,data,url,
2013-03-19,Future Group drops plan to sell stake in retail formats,https://economictimes.indiatimes.com/news/news-by-industry/services/retail/future-group-drops-plan-to-sell-stake-in-retail-formats/articleshow/19055250.cms,
2014-11-22,Future Group acquires Nilgiris grocery chain for about Rs 300 crore,https://economictimes.indiatimes.com/industry/services/retail/future-group-acquires-nilgiris-grocery-chain-for-about-rs-300-crore/articleshow/45237013.cms,
2017-06-02,Accumulate  Future Consumer Ltd.  target Rs  41:   Yes Securities,https://economictimes.indiatimes.com/markets/stocks/recos/accumulate-future-consumer-ltd-target-rs-41-yes-securities/articleshow/58955994.cms,
2014-10-30,"E-commerce 'euphoria' to last 18 months only: Kishore Biyani,  Future Group",https://economictimes.indiatimes.com/industry/services/retail/e-commerce-euphoria-to-last-18-months-only-kishore-biyani-future-group/articleshow/44985248.cms,
2016-07-27,"Flipkart-owned Myntra pips Snapdeal and Future Group, acquires Jabong for $70 million",https://economictimes.indiatimes.com/small-biz/startups/flipkart-owned-myntra-pips-snapdeal-and-future-group-acquires-jabong-for-70-million/articleshow/53390609.cms,
2016-12-20,Future Enterprises to sell 16% stake in Future Lifestyle,https://economictimes.indiatimes.com/industry/services/retail/future-enterprises-to-sell-16-stake-in-future-lifestyle/articleshow/56082989.cms,
2017-08-18,Future Group brings back Mayur Toshniwal to head supply chain operations,https://economictimes.indiatimes.com/industry/services/retail/future-group-brings-back-mayur-toshniwal-to-head-supply-chain-operations/articleshow/60109993.cms,
2017-01-22,Future Group rejigs top roles to push growth,https://economictimes.indiatimes.com/industry/services/retail/future-group-rejigs-top-roles-to-push-growth/articleshow/56722440.cms,
2015-02-17,Future Group in talks to buy Aditya Birla Group's wet wipes brand Kara,https://economictimes.indiatimes.com/industry/services/retail/future-group-in-talks-to-buy-aditya-birla-groups-wet-wipes-brand-kara/articleshow/46269102.cms,
2017-06-30,"Post GST, Future Group wants HUL to protect margins",https://economictimes.indiatimes.com/industry/services/retail/post-gst-future-group-wants-hul-to-protect-margins/articleshow/59377513.cms,
2017-04-04,"Kishore Biyani lines up loyalty-driven convenience stores to beat Amazon, Flipkart in discounts",https://economictimes.indiatimes.com/industry/services/retail/future-group-planning-loyalty-driven-convenience-stores/articleshow/57999059.cms,
2017-01-20,Future Consumer forms JV with Tilda Hain India,https://economictimes.indiatimes.com/industry/services/retail/future-consumer-forms-jv-with-tilda-hain-india/articleshow/56680888.cms,
2016-08-29,Future Group enters into a 50:50 JV in a Rs 60 crore project with InI Farms,https://economictimes.indiatimes.com/industry/services/retail/future-group-enters-into-a-5050-jv-in-a-rs-60-crore-project-with-ini-farms/articleshow/53911027.cms,
2011-09-14,Future Group-owned Indus League Clothing in talks to roll out Manchester United merchandise,https://economictimes.indiatimes.com/news/news-by-industry/cons-products/garments-/-textiles/future-group-owned-indus-league-clothing-in-talks-to-roll-out-manchester-united-merchandise/articleshow/9974382.cms,
2016-09-15,Future Group to add 6 more stores to Central brand,https://economictimes.indiatimes.com/industry/services/retail/future-group-to-add-6-more-stores-to-central-brand/articleshow/54347126.cms,
2016-03-11,"Future Group to bring out ads using word play targeting Flipkart, Snapdeal",https://economictimes.indiatimes.com/industry/services/retail/future-group-to-bring-out-ads-using-word-play-targeting-flipkart-snapdeal/articleshow/51351042.cms,
2012-07-20,"Future Group plans to set up 1,680 skill development centres",https://economictimes.indiatimes.com/news/news-by-industry/jobs/future-group-plans-to-set-up-1680-skill-development-centres/articleshow/15059466.cms,
2016-02-11,Future Consumer Enterprise reports Q3 loss at Rs 22.86 crore,https://economictimes.indiatimes.com/markets/stocks/earnings/future-consumer-enterprise-reports-q3-loss-at-rs-2286-crore/articleshow/50946318.cms,
2012-02-21,Kishore Biyani-led Future Group trims workforce,https://economictimes.indiatimes.com/news/news-by-industry/jobs/kishore-biyani-led-future-group-trims-workforce/articleshow/11972550.cms,
2016-06-21,"Bajaj Finance, Future Group to provide easy EMI to customers on groceries",https://economictimes.indiatimes.com/industry/services/retail/bajaj-finance-future-group-to-provide-easy-emi-to-customers-on-groceries/articleshow/52853805.cms,
2017-08-27,Future Group to focus on small stores to build brand presence,https://economictimes.indiatimes.com/industry/services/retail/future-group-to-focus-on-small-stores-to-build-brand-presence/articleshow/60244015.cms,
2013-03-26,"Larsen & Toubro, Future Group to merge general insurance businesses",https://economictimes.indiatimes.com/wealth/news/larsen-toubro-future-group-to-merge-general-insurance-businesses/articleshow/19220227.cms,
2016-08-04,Future Group could save Rs 300 crore in rental tax post GST: Kishore Biyani,https://economictimes.indiatimes.com/opinion/interviews/future-group-could-save-rs-300-crore-in-rental-tax-post-gst-kishore-biyani/articleshow/53538495.cms,
2012-01-13,BMC Software to integrate Future Group stores,https://economictimes.indiatimes.com/tech/software/bmc-software-to-integrate-future-group-stores/articleshow/11478549.cms,
2017-06-24,Future Group to set up its Central store in Kolkata's Metro Cinema property,https://economictimes.indiatimes.com/industry/services/retail/future-group-to-set-up-its-central-store-in-kolkatas-metro-cinema-property/articleshow/59300131.cms,
2012-06-01,Future Group partners LT Foods,https://economictimes.indiatimes.com/news/news-by-industry/cons-products/food/future-group-partners-lt-foods/articleshow/13705489.cms,
2011-07-25,"Coke, Future Group, Toshiba, Canon, others rush in to cash in on Sachin Tendulkar",https://economictimes.indiatimes.com/news/news-by-industry/services/advertising/coke-future-group-toshiba-canon-others-rush-in-to-cash-in-on-sachin-tendulkar/articleshow/9352123.cms,
2016-11-01,Arisaig India Fund trims 2.8% stake in Future Enterprises,https://economictimes.indiatimes.com/markets/stocks/news/arisaig-india-fund-trims-28-stake-in-future-enterprises/articleshow/55178611.cms,
2016-10-05,Future Group launches digital loyalty wallet FuturePay,https://economictimes.indiatimes.com/industry/services/retail/future-group-launches-digital-loyalty-wallet-futurepay/articleshow/54700024.cms,
2012-09-13,Future Group furniture retail business to breakeven this fiscal: Home Town president Mark Ladham,https://economictimes.indiatimes.com/news/news-by-industry/services/retail/future-group-furniture-retail-business-to-breakeven-this-fiscal-home-town-president-mark-ladham/articleshow/16383773.cms,
2012-01-31,"Future Group, Lifestyle and Woodland clock record sales as Republic Day discounts help retailers bounce back",https://economictimes.indiatimes.com/news/news-by-industry/services/retailing/future-group-lifestyle-and-woodland-clock-record-sales-as-republic-day-discounts-help-retailers-bounce-back/articleshow/11692362.cms,
2015-05-05,Kishore Biyani's Future group acquires Bharti Retail in an all-stock deal valued at Rs 500 crore,https://economictimes.indiatimes.com/industry/services/retail/kishore-biyanis-future-group-acquires-bharti-retail-in-an-all-stock-deal-valued-at-rs-500-crore/articleshow/47148446.cms,
2012-08-28,"Kirana stores throng big retailers like Future Group, Reliance Retail and others for better margins",https://economictimes.indiatimes.com/news/news-by-industry/services/retail/kirana-stores-throng-big-retailers-like-future-group-reliance-retail-and-others-for-better-margins/articleshow/15866194.cms,
2012-09-15,Bharti and Future Group may take lead in luring FDI in retail,https://economictimes.indiatimes.com/news/news-by-industry/services/retail/bharti-and-future-group-may-take-lead-in-luring-fdi-in-retail/articleshow/16405409.cms,
2017-03-01,"Will see a level-playing field after GST rollout in retail: Kishore Biyani, Future Group",https://economictimes.indiatimes.com/opinion/interviews/will-see-a-level-playing-field-after-gst-rollout-in-retail-kishore-biyani-future-group/articleshow/57405315.cms,
2015-06-03,Future Group bans Maggi at its stores amid safety concerns,https://economictimes.indiatimes.com/industry/cons-products/food/future-group-bans-maggi-at-its-stores-amid-safety-concerns/articleshow/47524855.cms,
2016-07-15,Snapdeal and Future Group are final contenders to acquire Jabong,https://economictimes.indiatimes.com/industry/services/retail/snapdeal-and-future-group-are-final-contenders-to-acquire-jabong/articleshow/53218537.cms,
2012-06-04,Future Group companies' shares rally on bourses on stake sale news,https://economictimes.indiatimes.com/markets/stocks/stocks-in-news/future-group-companies-shares-rally-on-bourses-on-stake-sale-news/articleshow/13820267.cms,
2012-01-04,"Slump in sales force Future Group, Reliance Retail, Shoppers Stop advance discount sales by 3 weeks",https://economictimes.indiatimes.com/news/news-by-industry/services/retailing/slump-in-sales-force-future-group-reliance-retail-shoppers-stop-advance-discount-sales-by-3-weeks/articleshow/11359414.cms,
2012-11-09,Kishore Biyani-promoted Future Group signs pact with IITL to sell life insurance JV Future Generali,https://economictimes.indiatimes.com/news/news-by-industry/banking/finance/kishore-biyani-promoted-future-group-signs-pact-with-iitl-to-sell-life-insurance-jv-future-generali/articleshow/17150373.cms,
2014-10-26,"Futurebazaar.com was ahead of the times: Kishore Biyani, CEO, Future Group",https://economictimes.indiatimes.com/opinion/interviews/futurebazaarcom-was-ahead-of-the-times-kishore-biyani-ceo-future-group/articleshow/44934566.cms,
2016-08-04,Future Group eyes Rs 1000 crore sales during Independence Day sale,https://economictimes.indiatimes.com/industry/services/retail/future-group-eyes-rs-1000-crore-sales-during-independence-day-sale/articleshow/53541944.cms,
2011-11-25,"FDI in retail: Indian retail & consumption story yet to begin in its full glory, says Kishore Biyani, CEO, Future Group",https://economictimes.indiatimes.com/news/economy/policy/fdi-in-retail-indian-retail-consumption-story-yet-to-begin-in-its-full-glory-says-kishore-biyani-ceo-future-group/articleshow/10863535.cms,
2012-12-05,"FDI in retail vote result welcome, reform a game-changer: Kishore Biyani, Future Group",https://economictimes.indiatimes.com/news/news-by-industry/services/retail/fdi-in-retail-vote-result-welcome-reform-a-game-changer-kishore-biyani-future-group/articleshow/17494146.cms,
2014-04-19,Future Group plans standalone stores for in-house brands,https://economictimes.indiatimes.com/industry/services/retail/future-group-plans-standalone-stores-for-in-house-brands/articleshow/33923421.cms,
2014-10-14,Future Group-Amazon partnership would have been different if negotiations with Flipkart had gone well,https://economictimes.indiatimes.com/industry/services/retail/future-group-amazon-partnership-would-have-been-different-if-negotiations-with-flipkart-had-gone-well/articleshow/44808699.cms,
2016-01-02,"Everstone, Future Group may end up in legal tussle over Future Media",https://economictimes.indiatimes.com/industry/services/retail/everstone-future-group-may-end-up-in-legal-tussle-over-future-media/articleshow/50411419.cms,
2017-05-17,"JV with Khimji Group is beginning of our global journey: Kishore Biyani, CEO, Future Group",https://economictimes.indiatimes.com/markets/expert-view/jv-with-khimji-group-is-beginning-of-our-global-journey-kishore-biyani-ceo-future-group/articleshow/58714659.cms,
2013-06-07,"Amazon seeks tie-up with local retailers like Future Group, Shoppers Stop to boost sales",https://economictimes.indiatimes.com/tech/internet/amazon-seeks-tie-up-with-local-retailers-like-future-group-shoppers-stop-to-boost-sales/articleshow/20469392.cms,
2016-09-22,Future Group acquires Sangam Direct chain of grocery stores,https://economictimes.indiatimes.com/industry/services/retail/future-group-acquires-sangam-direct-chain-of-grocery-stores/articleshow/54446956.cms,
2012-02-06,"Private labels owned by retailers such as Bharti Retail, Future Group outsell national brands in own stores",https://economictimes.indiatimes.com/news/news-by-industry/services/retailing/private-labels-owned-by-retailers-such-as-bharti-retail-future-group-outsell-national-brands-in-own-stores/articleshow/11772449.cms,
2014-11-01,Future Group ties up with Tesco arm for customer data analysis,https://economictimes.indiatimes.com/industry/services/retail/future-group-ties-up-with-tesco-arm-for-customer-data-analysis/articleshow/44996273.cms,
2015-08-18,Future Group sign joint venture agreement with Swiss firm Mibelle,https://economictimes.indiatimes.com/industry/services/retail/future-group-sign-joint-venture-agreement-with-swiss-firm-mibelle/articleshow/48529214.cms,
2011-11-26,Domestic retailers not worried about foreign competition,https://economictimes.indiatimes.com/news/news-by-industry/services/retailing/fdi-in-retail-domestic-retailers-like-future-group-reliance-retail-and-others-not-worried-about-foreign-competition/articleshow/10870056.cms,
2016-11-14,Future Consumer to enter JV with UK wholesaler Booker Group,https://economictimes.indiatimes.com/industry/services/retail/future-consumer-to-enter-jv-with-uk-wholesaler-booker-group/articleshow/55419145.cms,
2013-08-29,"Why seek foreign partners when we can tap PE funds: Kishore Biyani, Future Group",https://economictimes.indiatimes.com/opinion/interviews/why-seek-foreign-partners-when-we-can-tap-pe-funds-kishore-biyani-future-group/articleshow/22129777.cms,
2013-03-26,"Plan to sell non-core assets and concentrate on retail business: Kishore Biyani, Future Group",https://economictimes.indiatimes.com/opinion/interviews/plan-to-sell-non-core-assets-and-concentrate-on-retail-business-kishore-biyani-future-group/articleshow/19213182.cms,
2013-06-08,"Indian retailers Future Group, Spencer's turn to FII, IPO routes as FDI option vanishes",https://economictimes.indiatimes.com/news/news-by-industry/services/retail/indian-retailers-future-group-spencers-turn-to-fii-ipo-routes-as-fdi-option-vanishes/articleshow/20485357.cms,
2014-09-04,"Walmart, Future Group, Reliance Retail and Aditya Birla Group explore options in truncated Andhra Pradesh",https://economictimes.indiatimes.com/industry/services/retail/walmart-future-group-reliance-retail-and-aditya-birla-group-explore-options-in-truncated-andhra-pradesh/articleshow/41648757.cms,
2011-11-21,"Kishore Biyani-promoted Future Group to exit Generali JV, sell stake to IITL",https://economictimes.indiatimes.com/news/news-by-industry/services/retailing/kishore-biyani-promoted-future-group-to-exit-generali-jv-sell-stake-to-iitl/articleshow/10809429.cms,
2012-06-05,Future Group sells Future Capital Holdings to Warburg Pincus for Rs 800 cr,https://economictimes.indiatimes.com/news/news-by-industry/banking/finance/future-group-sells-future-capital-holdings-to-warburg-pincus-for-rs-800-cr/articleshow/13832093.cms,
2011-12-12,Future Group buys Transmart India warehousing business,https://economictimes.indiatimes.com/news/news-by-industry/services/retailing/future-group-buys-transmart-india-warehousing-business/articleshow/11075958.cms,
2012-06-01,Future Group ties up with L T Group,https://economictimes.indiatimes.com/news/news-by-company/corporate-announcement/future-group-ties-up-with-l-t-group/articleshow/13707188.cms,
2011-05-20,"Innovation at doorstep: Godrej, Future Group, Mirc spend time with consumers to design products to suit their needs",https://economictimes.indiatimes.com/news/news-by-company/corporate-trends/innovation-at-doorstep-godrej-future-group-mirc-spend-time-with-consumers-to-design-products-to-suit-their-needs/articleshow/8452572.cms,
2017-04-21,Future Group to sell its private labels through e-tail rivals,https://economictimes.indiatimes.com/industry/services/retail/future-group-to-sell-its-private-labels-through-e-tail-rivals/articleshow/58288378.cms,
2011-02-11,Future Group stalls Reckitt brands as FMCG slashes margins,https://economictimes.indiatimes.com/news/news-by-industry/services/retailing/future-group-stalls-reckitt-brands-as-fmcg-slashes-margins/articleshow/7472014.cms,
2012-02-14,Future Group redeploys its key executives,https://economictimes.indiatimes.com/news/news-by-industry/services/retailing/future-group-redeploys-its-key-executives/articleshow/11881086.cms,
2014-10-03,"Future Group brands may be sold through Amazon, logistics may be shared",https://economictimes.indiatimes.com/industry/services/retail/future-group-brands-may-be-sold-through-amazon-logistics-may-be-shared/articleshow/44143436.cms,
2015-03-17,Future Consumer Enterprise to raise Rs 100 crore through NCDs,https://economictimes.indiatimes.com/industry/services/retail/future-consumer-enterprise-to-raise-rs-100-crore-through-ncds/articleshow/46595791.cms,
2015-12-23,Kishore Biyani-led Future Consumer to consider FMCG distribution via franchisees,https://economictimes.indiatimes.com/industry/cons-products/fmcg/kishore-biyani-led-future-consumer-to-consider-fmcg-distribution-via-franchisees/articleshow/50293790.cms,
2011-07-07,Future Group to open 25-30 Big Bazaar outlets by June 2012,https://economictimes.indiatimes.com/news/news-by-industry/services/retailing/future-group-to-open-25-30-big-bazaar-outlets-by-june-2012/articleshow/9137691.cms,
2015-02-02,Kishore Biyani-promoted Future Group applies for payments bank licence,https://economictimes.indiatimes.com/industry/banking/finance/banking/kishore-biyani-promoted-future-group-applies-for-payments-bank-licence/articleshow/46094368.cms,
2014-04-14,Future Group to acquire Nilgiris for up to Rs 175 cr,https://economictimes.indiatimes.com/industry/services/retail/future-group-to-acquire-nilgiris-for-up-to-rs-175-cr/articleshow/33715792.cms,
2015-05-08,Future Group banking on analytics to battle e-commerce companies,https://economictimes.indiatimes.com/industry/services/retail/future-group-banking-on-analytics-to-battle-e-commerce-companies/articleshow/47196013.cms,
2012-02-13,Cognizant bags 5 year multi-million dollar IT outsourcing deal from Future Group,https://economictimes.indiatimes.com/tech/ites/cognizant-bags-5-year-multi-million-dollar-it-outsourcing-deal-from-future-group/articleshow/11870740.cms,
2013-04-25,Kishore Biyani Vs Mukesh Ambani: Relatively younger Reliance Retail is fast catching up on market leader Future Group,https://economictimes.indiatimes.com/news/news-by-company/corporate-trends/kishore-biyani-vs-mukesh-ambani-relatively-younger-reliance-retail-is-fast-catching-up-on-market-leader-future-group/articleshow/19717893.cms,
2011-12-20,Mistaken identity costs Future Group dear,https://economictimes.indiatimes.com/markets/stocks/stocks-in-news/mistaken-identity-costs-future-group-dear/articleshow/11173870.cms,
2013-05-14,CCI approves stake sale in Future Generali by Kishore Biyani-led Future Group,https://economictimes.indiatimes.com/news/news-by-company/corporate-trends/cci-approves-stake-sale-in-future-generali-by-kishore-biyani-led-future-group/articleshow/20050271.cms,
2011-10-02,Future Group eyes a bigger play in Indian education sector,https://economictimes.indiatimes.com/news/news-by-industry/services/education/future-group-eyes-a-bigger-play-in-indian-education-sector/articleshow/10204932.cms,
2017-02-24,Future Enterprises to redeem bonds to cut finance costs,https://economictimes.indiatimes.com/markets/stocks/news/future-enterprises-to-redeem-bonds-to-cut-finance-costs/articleshow/57326462.cms,
2017-03-18,Future Group to expand affordable fashion retail format,https://economictimes.indiatimes.com/industry/services/retail/future-group-to-expand-affordable-fashion-retail-format/articleshow/57710135.cms,
2014-01-22,Future Group plans 5% hiring target for differently abled workers,https://economictimes.indiatimes.com/industry/jobs/future-group-plans-5-hiring-target-for-differently-abled-workers/articleshow/29209604.cms,
2011-05-10,Future Group focussing on fashion and food to strengthen biz: Kishore Biyani,https://economictimes.indiatimes.com/opinion/interviews/future-group-focussing-on-fashion-and-food-to-strengthen-biz-kishore-biyani/articleshow/8215430.cms,
2011-10-28,"Punjabi pesarattus and masala fajitas: Heat and eat convenience foods becoming popular, says Damodar Mall, Future Group",https://economictimes.indiatimes.com/news/news-by-industry/cons-products/food/punjabi-pesarattus-and-masala-fajitas-heat-and-eat-convenience-foods-becoming-popular-says-damodar-mall-future-group/articleshow/10514215.cms,
2016-10-24,Procter & Gamble plans Walmart-like pact with Future Group,https://economictimes.indiatimes.com/news/company/deals/procter-gamble-plans-walmart-like-pact-with-future-group/articleshow/55027547.cms,
2017-04-19,"P&G, Future Group join hands to crack Indian retail puzzle",https://economictimes.indiatimes.com/news/company/deals/pg-future-group-join-hands-to-crack-indian-retail-puzzle/articleshow/58276608.cms,
2015-10-01,Future Group ropes in Vinay Bhatia to drive sales,https://economictimes.indiatimes.com/industry/services/retail/future-group-ropes-in-vinay-bhatia-to-drive-sales/articleshow/49179038.cms,
2012-09-20,Future Group buys convenience store chain Big Apple for Rs 62 crore,https://economictimes.indiatimes.com/news/news-by-industry/services/retail/future-group-buys-convenience-store-chain-big-apple-for-rs-62-crore/articleshow/16469657.cms,
2011-10-17,"Future Group kicks off rural wholesale, distribution venture",https://economictimes.indiatimes.com/news/news-by-industry/services/retailing/future-group-kicks-off-rural-wholesale-distribution-venture/articleshow/10392265.cms,
2011-04-19,Future Group sets up joint venture with UK's Clarks footwear,https://economictimes.indiatimes.com/news/news-by-industry/services/retailing/future-group-sets-up-joint-venture-with-uks-clarks-footwear/articleshow/8026681.cms,
2012-07-20,Future Group tie up with National Skill Development for sustainable livelihood,https://economictimes.indiatimes.com/news/news-by-industry/jobs/future-group-tie-up-with-national-skill-development-for-sustainable-livelihood/articleshow/15055569.cms,
2013-04-04,"Future Group, CEOs JV buy majority stake in Staples",https://economictimes.indiatimes.com/news/news-by-industry/services/retail/future-group-ceos-jv-buy-majority-stake-in-staples/articleshow/19369238.cms,
2014-05-04,Future Group contemplating retailing private brands,https://economictimes.indiatimes.com/industry/services/retail/future-group-contemplating-retailing-private-brands/articleshow/34629824.cms,
2012-11-09,Kishore Biyani controlled Future Group mulls a separate entity,https://economictimes.indiatimes.com/news/news-by-industry/services/retail/kishore-biyani-controlled-future-group-mulls-a-separate-entity/articleshow/17158065.cms,
2015-07-07,Future Group launches 18-month course in design management with MISB Bocconi,https://economictimes.indiatimes.com/industry/services/education/future-group-launches-18-month-course-in-design-management-with-misb-bocconi/articleshow/47966013.cms,
2013-05-20,"Retailers like Future Group, RP-Sanjiv Goenka Group, Reliance adopting kirana-store model to push sales",https://economictimes.indiatimes.com/news/news-by-industry/services/retail/retailers-like-future-group-rp-sanjiv-goenka-group-reliance-adopting-kirana-store-model-to-push-sales/articleshow/20144221.cms,
2014-04-18,Future Group plans to expand fashion retail business,https://economictimes.indiatimes.com/industry/services/retail/future-group-plans-to-expand-fashion-retail-business/articleshow/33912205.cms,
2013-04-25,Future Group vs Reliance Retail: stories behind the numbers,https://economictimes.indiatimes.com/news/news-by-industry/services/retail/future-group-vs-reliance-retail-stories-behind-the-numbers/articleshow/19718322.cms,
2012-11-10,"Big retailers like Future Group, Mango plan to remove restrictions on carry bags despite rampant shoplifting",https://economictimes.indiatimes.com/news/news-by-industry/services/retail/big-retailers-like-future-group-mango-plan-to-remove-restrictions-on-carry-bags-despite-rampant-shoplifting/articleshow/17163442.cms,
2011-05-23,Kishore Biyani's Future Group enters elite gourmet retailing,https://economictimes.indiatimes.com/news/news-by-industry/cons-products/food/kishore-biyanis-future-group-enters-elite-gourmet-retailing/articleshow/8519205.cms,
2011-03-10,Future Group eyes Rs 18k cr rev from mobile telephony in 3 years,https://economictimes.indiatimes.com/news/news-by-industry/telecom/future-group-eyes-rs-18k-cr-rev-from-mobile-telephony-in-3-years/articleshow/7673475.cms,
2011-10-11,"What cos like Future Group, Piramal Healthcare, Dabur, PepsiCo, Nestle and others are doing to tap the Rs 30,000 crore slum economy",https://economictimes.indiatimes.com/news/news-by-company/corporate-trends/what-cos-like-future-group-piramal-healthcare-dabur-pepsico-nestle-and-others-are-doing-to-tap-the-rs-30000-crore-slum-economy/articleshow/10307850.cms,
2011-09-30,"10,000+ social media experts required as UB Group, LG Electronics, Canon, Future Group and others plan aggressive hiring",https://economictimes.indiatimes.com/news/news-by-industry/jobs/10000-social-media-experts-required-as-ub-group-lg-electronics-canon-future-group-and-others-plan-aggressive-hiring/articleshow/10177429.cms,
2016-04-26,"Future group, Anil Ambani companies are high-risk, high-return ideas: Amisha Vora, Prabhudas Lilladher",https://economictimes.indiatimes.com/markets/expert-view/future-group-anil-ambani-companies-are-high-risk-high-return-ideas-amisha-vora-prabhudas-lilladher/articleshow/51989227.cms,
